{
  "schema": 1,
  "version": "2026-10-26",
  "generated_at": "2026-10-26T12:00:00Z",
  "license": "CC-BY-4.0",
  "attribution": "Posterna conformance fixture. The anthropic and google records are frozen copies of the operator directory.",
  "operators": [
    {
      "slug": "anthropic",
      "name": "Anthropic",
      "website": "https://www.anthropic.com/",
      "docs_url": "https://support.claude.com/en/articles/8896518-does-anthropic-crawl-data-from-the-web-and-how-can-site-owners-block-the-crawler",
      "coverage": "researched",
      "note": null,
      "verification": {
        "signing": {
          "status": "none_found",
          "directory_url": null,
          "kid_convention": null,
          "purpose_field": null,
          "covers": [],
          "note": "Anthropic's article does not mention request signing, and no third-party report was found. On 2026-10-26 /.well-known/http-message-signatures-directory returned 404 on claude.ai, claude.com and www.anthropic.com. No key directory found in the operator's documentation.",
          "sources": []
        },
        "ip_lists": [
          {
            "agent": "anthropic-bots",
            "url": "https://claude.com/crawling/bots.json",
            "format": "ipranges-json",
            "prefix_count": 14,
            "fetched_at": "2026-10-26T23:06:35.460Z",
            "sha256": "c960bb55504c3c478d0335bc7153e9ca871c26388a69e403cbad121a5bb5c5dd",
            "prefixes": [
              "34.152.124.140/32",
              "34.153.21.190/32",
              "34.162.27.34/32",
              "34.162.86.102/32",
              "34.162.90.102/32",
              "34.162.111.78/32",
              "34.162.153.71/32",
              "34.162.191.81/32",
              "34.162.230.222/32",
              "34.162.244.71/32",
              "34.186.252.4/32",
              "136.79.143.251/32",
              "136.83.20.215/32",
              "216.73.216.0/22"
            ],
            "note": null,
            "sources": [
              {
                "url": "https://support.claude.com/en/articles/8896518-does-anthropic-crawl-data-from-the-web-and-how-can-site-owners-block-the-crawler",
                "title": "Does Anthropic crawl data from the web, and how can site owners block the crawler?",
                "fetched_at": "2026-10-26T23:06:36.530Z"
              }
            ]
          }
        ],
        "reverse_dns": null,
        "asn": []
      },
      "agents": [
        {
          "name": "Claude-SearchBot",
          "coverage": "researched",
          "user_agent_tokens": [
            "Claude-SearchBot"
          ],
          "aliases": [],
          "purpose": "search",
          "purpose_quote": "Claude-SearchBot navigates the web to improve search result quality for users.",
          "search_engine": false,
          "robots_token": "Claude-SearchBot",
          "robots_policy": "honors",
          "robots_quote": "Anthropic’s Bots respect “do not crawl” signals by honoring industry standard directives in robots.txt.",
          "ip_list_agent": "anthropic-bots",
          "signs": false,
          "note": "No full User-Agent string is given; the token is the bot name the article uses.",
          "sources": [
            {
              "url": "https://support.claude.com/en/articles/8896518-does-anthropic-crawl-data-from-the-web-and-how-can-site-owners-block-the-crawler",
              "title": "Does Anthropic crawl data from the web, and how can site owners block the crawler?",
              "fetched_at": "2026-10-26T23:06:36.530Z"
            }
          ]
        },
        {
          "name": "Claude-User",
          "coverage": "researched",
          "user_agent_tokens": [
            "Claude-User"
          ],
          "aliases": [],
          "purpose": "user_fetch",
          "purpose_quote": "When individuals ask questions to Claude, it may access websites using a Claude-User agent.",
          "search_engine": false,
          "robots_token": "Claude-User",
          "robots_policy": "honors",
          "robots_quote": "Anthropic’s Bots respect “do not crawl” signals by honoring industry standard directives in robots.txt.",
          "ip_list_agent": "anthropic-bots",
          "signs": false,
          "note": "The robots.txt statement covers all three of Anthropic's bots, including this user-triggered one. The article also says Claude-User lets site owners control which sites these user-initiated requests can reach. No full User-Agent string is given; the token is the bot name the article uses.",
          "sources": [
            {
              "url": "https://support.claude.com/en/articles/8896518-does-anthropic-crawl-data-from-the-web-and-how-can-site-owners-block-the-crawler",
              "title": "Does Anthropic crawl data from the web, and how can site owners block the crawler?",
              "fetched_at": "2026-10-26T23:06:36.530Z"
            }
          ]
        },
        {
          "name": "ClaudeBot",
          "coverage": "researched",
          "user_agent_tokens": [
            "ClaudeBot"
          ],
          "aliases": [],
          "purpose": "training",
          "purpose_quote": "ClaudeBot helps enhance the utility and safety of our generative AI models by collecting web content that could potentially contribute to their training.",
          "search_engine": false,
          "robots_token": "ClaudeBot",
          "robots_policy": "honors",
          "robots_quote": "Anthropic’s Bots respect “do not crawl” signals by honoring industry standard directives in robots.txt.",
          "ip_list_agent": "anthropic-bots",
          "signs": false,
          "note": "Anthropic also says it supports the non-standard Crawl-delay directive. The article does not give full User-Agent strings; the token is the bot name it uses in its robots.txt examples.",
          "sources": [
            {
              "url": "https://support.claude.com/en/articles/8896518-does-anthropic-crawl-data-from-the-web-and-how-can-site-owners-block-the-crawler",
              "title": "Does Anthropic crawl data from the web, and how can site owners block the crawler?",
              "fetched_at": "2026-10-26T23:06:36.530Z"
            }
          ]
        },
        {
          "name": "anthropic-ai",
          "coverage": "community",
          "user_agent_tokens": [
            "anthropic-ai"
          ],
          "aliases": [],
          "purpose": "training",
          "purpose_quote": null,
          "search_engine": false,
          "robots_token": "anthropic-ai",
          "robots_policy": "unstated",
          "robots_quote": null,
          "ip_list_agent": null,
          "signs": false,
          "note": "Community record from ai.robots.txt. Function: \"Scrapes data to train Anthropic's AI products.\". Respects robots.txt: \"Unclear at this time.\".",
          "sources": [
            {
              "url": "https://raw.githubusercontent.com/ai-robots-txt/ai.robots.txt/main/robots.json",
              "title": "ai.robots.txt robots.json",
              "fetched_at": "2026-10-26T23:05:56.726Z"
            }
          ]
        },
        {
          "name": "Claude-Code",
          "coverage": "community",
          "user_agent_tokens": [
            "Claude-Code"
          ],
          "aliases": [],
          "purpose": "agent",
          "purpose_quote": null,
          "search_engine": false,
          "robots_token": "Claude-Code",
          "robots_policy": "unstated",
          "robots_quote": null,
          "ip_list_agent": null,
          "signs": false,
          "note": "Community record from ai.robots.txt. Function: \"AI Coding Agents\". Respects robots.txt: \"Unclear at this time.\".",
          "sources": [
            {
              "url": "https://raw.githubusercontent.com/ai-robots-txt/ai.robots.txt/main/robots.json",
              "title": "ai.robots.txt robots.json",
              "fetched_at": "2026-10-26T23:05:56.726Z"
            }
          ]
        },
        {
          "name": "Claude-Web",
          "coverage": "community",
          "user_agent_tokens": [
            "Claude-Web"
          ],
          "aliases": [],
          "purpose": "agent",
          "purpose_quote": null,
          "search_engine": false,
          "robots_token": "Claude-Web",
          "robots_policy": "unstated",
          "robots_quote": null,
          "ip_list_agent": null,
          "signs": false,
          "note": "Community record from ai.robots.txt. Function: \"Undocumented AI Agents\". Respects robots.txt: \"Unclear at this time.\".",
          "sources": [
            {
              "url": "https://raw.githubusercontent.com/ai-robots-txt/ai.robots.txt/main/robots.json",
              "title": "ai.robots.txt robots.json",
              "fetched_at": "2026-10-26T23:05:56.726Z"
            }
          ]
        }
      ],
      "observed": {},
      "enrollment": {
        "status": "none"
      },
      "identity_anchors": [],
      "sources": [
        {
          "url": "https://support.claude.com/en/articles/8896518-does-anthropic-crawl-data-from-the-web-and-how-can-site-owners-block-the-crawler",
          "title": "Does Anthropic crawl data from the web, and how can site owners block the crawler?",
          "fetched_at": "2026-10-26T23:06:36.530Z"
        }
      ]
    },
    {
      "slug": "community-operator",
      "name": "Community Operator",
      "website": null,
      "docs_url": null,
      "coverage": "community",
      "note": "Synthetic conformance fixture.",
      "verification": {
        "signing": {
          "status": "not_probed",
          "directory_url": null,
          "kid_convention": null,
          "purpose_field": null,
          "covers": [],
          "note": null,
          "sources": []
        },
        "ip_lists": [],
        "reverse_dns": null,
        "asn": []
      },
      "agents": [
        {
          "name": "CommunityBot",